data = [
    ("Бронь на 3 июля 2025 года.", [("date", "2025-07-03")]),
    ("10.08.2026", [("date", "2026-08-10")]),
    ("Отправление 25 декабря.", [("date", "2026-12-25")]),
    ("Прилёт 01.01.2027", [("date", "2027-01-01")]),
    ("Бронирование на 7 марта 2025 г.", [("date", "2025-03-07")]),
    ("Вылет 30 ноября.", [("date", "2026-11-30")]),
    ("Дата поездки — 14 февраля.", [("date", "2026-02-14")]),
    ("Улетаю 9 мая 2026 года.", [("date", "2026-05-09")]),
    ("Рейс назначен на 31 октября.", [("date", "2026-10-31")]),
    ("Планирую поездку 18 сентября.", [("date", "2026-09-18")]),
    ("Обратный вылет 22.04.2025", [("date", "2025-04-22")]),
    ("Отдых с 10 по 20 июня.", [("date", "2026-06-10"), ("date", "2026-06-20")]),
    ("Вылет 29 февраля 2028 года.", [("date", "2028-02-29")]),
    ("Бронь на 31.12.2026", [("date", "2026-12-31")]),
    ("Отправляюсь 1 января.", [("date", "2026-01-01")]),
    ("Обратный рейс 15 августа 2025.", [("date", "2025-08-15")]),
    ("Дата вылета — 7 июля.", [("date", "2026-07-07")]),
    ("Улетаю через неделю.", []),
    ("Планирую поездку на майские.", []),
    ("Рейс назначен на 04.09.2027", [("date", "2027-09-04")]),
    ("Возвращаюсь 20 октября.", [("date", "2026-10-20")]),

    ("Рейс в 14:30.", [("time", "14:30:00")]),
    ("Вылет в полтретьего дня.", [("time", "14:30:00")]),
    ("Самолёт уходит в 9 утра.", [("time", "09:00:00")]),
    ("Посадка в 23:59.", [("time", "23:59:00")]),
    ("Вылет в 08:15 утра.", [("time", "08:15:00")]),
    ("Посадка начинается в 21:45.", [("time", "21:45:00")]),
    ("Самолёт стартует в полшестого вечера.", [("time", "17:30:00")]),
    ("Рейс в 13:00.", [("time", "13:00:00")]),
    ("Отправление в полночь.", [("time", "00:00:00")]),
    ("Прибытие в 2:30 ночи.", [("time", "02:30:00")]),
    ("Вылет в девять вечера.", [("time", "21:00:00")]),
    ("Самолёт уходит в полдень.", [("time", "12:00:00")]),
    ("Взлёт в 05:55 утром.", [("time", "05:55:00")]),
    ("Вылет в 00:05 ночи.", [("time", "00:05:00")]),
    ("Посадка в полпервого дня.", [("time", "12:30:00")]),
    ("Самолёт стартует в 17:00.", [("time", "17:00:00")]),
    ("Регистрация закрывается в 10 утра.", [("time", "10:00:00")]),
    ("Прибытие в 23:59:59.", [("time", "23:59:59")]),
    ("Взлёт в девять тридцать вечера.", [("time", "21:30:00")]),
    ("Отправление в полночь ровно.", [("time", "00:00:00")]),
    ("Вылет в два часа дня.", [("time", "14:00:00")]),
    ("Посадка начинается в 06:45 утра.", [("time", "06:45:00")]),

    ("Мой паспорт 64 1234567.", [("INTERNATIONAL", "64 1234567")]),
    ("Документ 513456789.", [("INTERNATIONAL", "51 3456789")]),
    ("Паспорт: 50-01-123456", [("PASSPORT", "5001 123456")]),
    ("Паспорт РФ 45 09876546.", [("PASSPORT", "4509 876546")]),
    ("Документ: 77-12-345678", [("PASSPORT", "7712 345678")]),
    ("Номер паспорта 92 11223347.", [("PASSPORT", "9211 223347")]),
    ("Загранник 64 1112223.", [("INTERNATIONAL", "64 1112223")]),
    ("Международный паспорт 51 4567890.", [("INTERNATIONAL", "51 4567890")]),
    ("Документ 33 99887765.", [("PASSPORT", "3399 887765")]),
    ("Паспорт 99 88776658", [("PASSPORT", "9988 776658")]),
    ("Документ: 77-99-887766", [("PASSPORT", "7799 887766")]),
    ("Номер загранника 64 9876543", [("INTERNATIONAL", "64 9876543")]),
    ("Паспортные данные: 50 11122235", [("PASSPORT", "5011 122235")]),
    ("Паспорт 3334445556", [("PASSPORT", "3334 445556")]),

    ("Пишите на support@s7.ru", [("EMAIL", "support@s7.ru")]),
    ("Звоните +7 900 123-45-67", [("PHONE", "+7 (900) 123-45-67")]),
    ("Телефон 89001234567", [("PHONE", "+7 (900) 123-45-67")]),
    ("Мой email: traveler@s7.aero", [("EMAIL", "traveler@s7.aero")]),
    ("Свяжитесь со мной: kirill_ivanov@mail.ru", [("EMAIL", "kirill_ivanov@mail.ru")]),
    ("Телефон +7(495)123-45-67", [("PHONE", "+7 (495) 123-45-67")]),
    ("Номер 8 800 555 3535", [("PHONE", "+7 (800) 555-35-35")]),
    ("Почта — info@aircompany.com", [("EMAIL", "info@aircompany.com")]),
    ("Почта: user.name+tag@domain.co.uk", [("EMAIL", "user.name+tag@domain.co.uk")]),
    ("Телефон: +7 999 888 77 66", [("PHONE", "+7 (999) 888-77-66")]),
    ("Связь: 8(800)555-35-35", [("PHONE", "+7 (800) 555-35-35")]),
    ("Email — test_email123@airline.su", [("EMAIL", "test_email123@airline.su")]),
    ("Моб: 9261234567", [("PHONE", "+7 (926) 123-45-67")]),
    ("Напишите на info@s7-support.ru", [("EMAIL", "info@s7-support.ru")]),

    ("Лечу из Домодедово в Сочи.", [("airport", "домодедово"), ("location", "Сочи")]),
    ("Прибытие в Новосибирск.", [("location", "Новосибирск")]),
    ("Вылет из VKO.", [("IATA", "VKO")]),
    ("Прилёт в LED.", [("IATA", "LED")]),
    ("Лечу из Шереметьево в Екатеринбург.", [("airport", "шереметьево"), ("location", "Екатеринбург")]),
    ("Прибытие в аэропорт Симферополь.", [("airport", "симферополь")]),
    ("Вылет из KZN.", [("IATA", "KZN")]),
    ("Пункт назначения — OVB.", [("IATA", "OVB")]),
    ("Отправляюсь из Пулково.", [("airport", "пулково")]),
    ("Прилёт в город Краснодар.", [("location", "Краснодар")]),
    ("Рейс приземлится в UFA.", [("IATA", "UFA")]),
    ("Старт из а/п Внуково.", [("airport", "внуково")]),
    ("Лечу из Кольцово в Сочи.", [("airport", "кольцово"), ("location", "Сочи")]),
    ("Прибытие в аэропорт Домодедово.", [("airport", "домодедово")]),
    ("Вылет из SVX.", [("IATA", "SVX")]),
    ("Пункт назначения — KJA.", [("IATA", "KJA")]),
    ("Отправляюсь из а/п Пулково.", [("airport", "пулково")]),
    ("Город прибытия — Минеральные Воды.", [("location", "Минеральные Воды")]),
    ("Рейс приземлится в ROV.", [("IATA", "ROV")]),
    ("Старт из аэропорта Внуково.", [("airport", "внуково")]),

    ("Мой заказ ABC123.", [("ORDER_NUMBER", "ABC123")]),
    ("Билет 5851234567890.", [("TICKET_NUMBER", "5851234567890")]),
    ("Рейс S7 501.", [("FLIGHT", "S7 501")]),
    ("Мой код бронирования XYZ789.", [("ORDER_NUMBER", "XYZ789")]),
    ("Номер билета 5859876543210.", [("TICKET_NUMBER", "5859876543210")]),
    ("Рейс S71234.", [("FLIGHT", "S7 1234")]),
    ("Бронь подтверждена: QWERTY1.", [("ORDER_NUMBER", "QWERTY1")]),
    ("Билет: 5850001112223.", [("TICKET_NUMBER", "5850001112223")]),
    ("Летим S7 999.", [("FLIGHT", "S7 999")]),
    ("Код заказа A1B2C3.", [("ORDER_NUMBER", "A1B2C3")]),
    ("Номер рейса S7050.", [("FLIGHT", "S7 050")]),
    ("Код бронирования: HELLO7", [("ORDER_NUMBER", "HELLO7")]),
    ("Билет 5851122334455", [("TICKET_NUMBER", "5851122334455")]),
    ("Рейс S7 1024", [("FLIGHT", "S7 1024")]),
    ("Номер заказа: Z9Y8X7", [("ORDER_NUMBER", "Z9Y8X7")]),
    ("Билетной номер — 5859988776655", [("TICKET_NUMBER", "5859988776655")]),
    ("Летим рейсом S7555", [("FLIGHT", "S7 555")]),
    ("Мой код: A7B8C9D", [("ORDER_NUMBER", "A7B8C9D")]),
    ("Номер рейса S7 007", [("FLIGHT", "S7 007")]),
    
    # Даты и время — 50 примеров

("Вылет 1 января 2027 года.", [("date", "2027-01-01")]),
("Прибытие 31.12.2026", [("date", "2026-12-31")]),
("Бронь на 15 июля.", [("date", "2026-07-15")]),
("Дата рейса — 03.09.2025", [("date", "2025-09-03")]),
("Улетаю 29 февраля 2028.", [("date", "2028-02-29")]),
("Планирую поездку на 10 октября.", [("date", "2026-10-10")]),
("Обратный вылет 22.11.2026", [("date", "2026-11-22")]),

("Рейс в 06:00 утра.", [("time", "06:00:00")]),
("Посадка в 23:59.", [("time", "23:59:00")]),
("Вылет в полшестого вечера.", [("time", "17:30:00")]),
("Самолёт стартует в 12:00.", [("time", "12:00:00")]),
("Регистрация до 14:15.", [("time", "14:15:00")]),
("Прибытие в полночь.", [("time", "00:00:00")]),
("Взлёт в девять утра.", [("time", "09:00:00")]),
("Отправление в полдень.", [("time", "12:00:00")]),
("Посадка начинается в 05:30 ночи.", [("time", "05:30:00")]),
("Рейс задержан до 18:45.", [("time", "18:45:00")]),

("Лечу 5 мая в 10:30.", [("date", "2026-05-05"), ("time", "10:30:00")]),
("Вылет 20.12.2026 в 22:00.", [("date", "2026-12-20"), ("time", "22:00:00")]),
("Бронь на 7 марта в 09:00.", [("date", "2026-03-07"), ("time", "09:00:00")]),
("Прибытие 1 января в полночь.", [("date", "2027-01-01"), ("time", "00:00:00")]),
("Отправляюсь 30 ноября в 17:20.", [("date", "2026-11-30"), ("time", "17:20:00")]),
("Возвращаюсь 14 февраля в 21:00.", [("date", "2026-02-14"), ("time", "21:00:00")]),
("Рейс назначен на 10 октября 2026 в 06:45.", [("date", "2026-10-10"), ("time", "06:45:00")]),

("Вылет в 00:01 ночи.", [("time", "00:01:00")]),
("Посадка в 12:30 дня.", [("time", "12:30:00")]),
("Самолёт уходит в два часа ночи.", [("time", "02:00:00")]),
("Регистрация закрывается в 11 утра.", [("time", "11:00:00")]),
("Прибытие в 23:00 вечера.", [("time", "23:00:00")]),
("Взлёт в полвосьмого утра.", [("time", "07:30:00")]),
("Отправление в 15:15.", [("time", "15:15:00")]),
("Посадка в 04:55 утра.", [("time", "04:55:00")]),
("Рейс в 19:30.", [("time", "19:30:00")]),
("Вылет в десять вечера.", [("time", "22:00:00")]),

("Дата поездки — 01.01.2027", [("date", "2027-01-01")]),
("Улетаю 31 декабря.", [("date", "2026-12-31")]),
("Бронирование на 1 апреля.", [("date", "2026-04-01")]),
("Прибытие 29.02.2028", [("date", "2028-02-29")]),
("Отправляюсь 7 июля 2025 года.", [("date", "2025-07-07")]),
("Возвращаюсь 31 октября.", [("date", "2026-10-31")]),




("Вылет 12.08.2026 в 07:30 из Шереметьево.", [("date", "2026-08-12"), ("time", "07:30:00"), ("airport", "шереметьево")]),
("Мой паспорт 77 98765437, email ivanov@mail.ru", [("PASSPORT", "7798 765437"), ("EMAIL", "ivanov@mail.ru")]),
("Билет 5851234567890, телефон +7 495 123-45-67", [("TICKET_NUMBER", "5851234567890"), ("PHONE", "+7 (495) 123-45-67")]),
("Документ 21 1122334, код брони XYZ987", [("INTERNATIONAL", "21 1122334"), ("ORDER_NUMBER", "XYZ987")]),
("Прибытие в Новосибирск 25 декабря в полдень.", [("location", "Новосибирск"), ("date", "2026-12-25"), ("time", "12:00:00")]),
("Паспорт: 50-01-987654, email support@s7.ru", [("PASSPORT", "5001 987654"), ("EMAIL", "support@s7.ru")]),
("Рейс S71234, вылет в 23:59 из Домодедово.", [("FLIGHT", "S7 1234"), ("time", "23:59:00"), ("airport", "домодедово")]),
("Телефон 89001234567, дата поездки — 01.01.2027", [("PHONE", "+7 (900) 123-45-67"), ("date", "2027-01-01")]),

("Мой загранпаспорт 64 1234567, заказ HELLO1", [("INTERNATIONAL", "64 1234567"), ("ORDER_NUMBER", "HELLO1")]),
("Вылет в полшестого из Пулково, билет 5859988776655", [("time", "17:30:00"), ("airport", "пулково"), ("TICKET_NUMBER", "5859988776655")]),
("Пишите на info@airline.com, паспорт 99 1112223", [("EMAIL", "info@airline.com"), ("PASSPORT", "99 1112223")]),
("Номер телефона +7(800)555-35-35, дата 15 июля.", [("PHONE", "+7 (800) 555-35-35"), ("date", "2026-07-15")]),
("Прилёт в OVB 30 ноября в 09:15.", [("IATA", "OVB"), ("date", "2026-11-30"), ("time", "09:15:00")]),
("Паспортные данные: 33 44556678, email user@domain.co", [("PASSPORT", "3344 556678"), ("EMAIL", "user@domain.co")]),
("Вылет из Кольцово (SVX) 10 октября в 13:00.", [("airport", "кольцово"), ("IATA", "SVX"), ("date", "2026-10-10"), ("time", "13:00:00")]),
("Код заказа A1B2C3D, билет 5850001112223", [("ORDER_NUMBER", "A1B2C3D"), ("TICKET_NUMBER", "5850001112223")]),

("Международный паспорт 45 9876543, телефон 9161234567", [("INTERNATIONAL", "45 9876543"), ("PHONE", "+7 (916) 123-45-67")]),
("Полёт в Симферополь 1 января 2027 в полпервого.", [("location", "Симферополь"), ("date", "2027-01-01"), ("time", "12:30:00")]),
("Документ 51 1234567, email flight@s7.aero", [("INTERNATIONAL", "51 1234567"), ("EMAIL", "flight@s7.aero")]),
("Паспорт 0102345678, номер рейса S7555", [("PASSPORT", "0102 345678"), ("FLIGHT", "S7 555")]),
("Прибытие в Минеральные Воды 20.09.2026 в 22:00.", [("location", "Минеральные Воды"), ("date", "2026-09-20"), ("time", "22:00:00")]),
("Телефон +7 999 888 77 66, заказ QWERTY7", [("PHONE", "+7 (999) 888-77-66"), ("ORDER_NUMBER", "QWERTY7")]),
("Билет 5851122334455, вылет из Внуково в 17:20.", [("TICKET_NUMBER", "5851122334455"), ("airport", "внуково"), ("time", "17:20:00")]),
("Дата — 29.02.2028, время — полдень, аэропорт — DME", [("date", "2028-02-29"), ("time", "12:00:00"), ("IATA", "DME")]),

("Email: test_email+tag@company.su, телефон 88005553535", [("EMAIL", "test_email+tag@company.su"), ("PHONE", "+7 (800) 555-35-35")]),
("Рейс S7 1024, вылет 5 мая в 08:00 из KJA.", [("FLIGHT", "S7 1024"), ("date", "2026-05-05"), ("time", "08:00:00"), ("IATA", "KJA")]),
("Паспорт 92 11223346, билет 5859988776655", [("PASSPORT", "9211 223346"), ("TICKET_NUMBER", "5859988776655")]),
("Посадка в 00:05 ночи, дата — 31 декабря.", [("time", "00:05:00"), ("date", "2026-12-31")]),
("Код бронирования Z9Y8X7, email admin@support.ru", [("ORDER_NUMBER", "Z9Y8X7"), ("EMAIL", "admin@support.ru")]),
("Вылет в два часа ночи из Домодедово, билет 5850001112223", [("time", "02:00:00"), ("airport", "домодедово"), ("TICKET_NUMBER", "5850001112223")]),
("Паспортные данные: 50 11122234, телефон +7(926)123-45-67", [("PASSPORT", "5011 122234"), ("PHONE", "+7 (926) 123-45-67")]),
("Прибытие 1 апреля в 23:59 в Новосибирск.", [("date", "2026-04-01"), ("time", "23:59:00"), ("location", "Новосибирск")]),

("Международный документ 21 5556667, заказ HELLO7", [("INTERNATIONAL", "21 5556667"), ("ORDER_NUMBER", "HELLO7")]),
("Паспорт 3334445556, email user.name@domain.co.uk", [("PASSPORT", "3334 445556"), ("EMAIL", "user.name@domain.co.uk")]),
("Телефон 89261234567, дата вылета — 10.10.2026", [("PHONE", "+7 (926) 123-45-67"), ("date", "2026-10-10")]),
("Билетной номер 5851122334455, вылет в 09:00 из Пулково.", [("TICKET_NUMBER", "5851122334455"), ("time", "09:00:00"), ("airport", "пулково")]),
("Полёт в Екатеринбург 15 августа в полночь.", [("location", "Екатеринбург"), ("date", "2026-08-15"), ("time", "00:00:00")]),
("Код заказа A7B8C9D, паспорт 45 09876548", [("ORDER_NUMBER", "A7B8C9D"), ("PASSPORT", "4509 876548")]),
("Прилёт в LED 22 октября в 18:45.", [("IATA", "LED"), ("date", "2026-10-22"), ("time", "18:45:00")]),
    ]